Reviewer,Review
Waheed Zafar,there are no bells and whistles but the service is brilliant and food amazing. the only draw back is poor quality of monitors movies and games. if you take your own iPad and can watch movies this is ideal. price of tickets is half of other airlines and flight times are ideal no middle of night arrivals or departures
14mohammad,"We were coming from Los Angeles to Karachi in Etihad Airways… not knowing that from Abu Dhabi Etihad Airways will hand us off to the PIA we didn’t have too many options but to wait and see. Last time I traveled in PIA was in 2001 and one can already tell that this business will not do well in the future. As compare with other airlines, they were bad in all categories: Unsafe Aircrafts, bad customer service and bad food – after a decade found out that this airline went from bad to worst. Forget about any internment the feeling in the aircraft was very unsafe… on takeoff and landing each and every nut/bolt was shaking like they will come out from their sockets and couple of the overhead compartment fell open. The instructions on where the life waist is, were in English and from God knows which other language. The crew didn’t give us the embarkation cards and we had to go through the hassle of filling them out on the FBI counter. The food was so bad that though we were hungry from all night, we were not able to take another bite of that “spoiled/cold/baasi-food”. The so-called shami kababs were half-wrapped in aluminum foil and were COLD, the bread tasted stale. After reaching Karachi I called Etihad and made sure that we are not going back to Abu Dhabi in PIA. I will not recommend anyone to fly in PIA!!!!"
Hassan R,"they flew late, plane was very old, seating mix up, jam packed plane and not enough space in overhead compartment for people for their carry-ons, service was very bad, my seat just would not stay in place."
Salman A,"well where does one begin......the plane was late in arriving and hence took after 1.45 minutes behind schedule, no apologies tendered, no remorse....then the plane was an attached to a satellite, but we had to take a bus ride which was about 16 minutes......felt like we were going on forever......after boarding the plane, sitting down discovered that there wasn't any inflight entertainment.....NONE...........the food that they served must have been sitting in an oven for over an hour, DRY, EVAPORATED,DRAINED .....what more can i say........never again"
Salman F,"I traveled to Karachi and Back to Lahore last week with PIA... I notices some very positive changes. The Flight was on time infact a little bit before time :). The crew was hospitable, courteous and welcoming. Food was good too. Overall good experience"
mohammed k,terrible airport people trying to steal money of you hassle you for no reason. worst airport I have been in the staff are all looking for a bribe and the airplane is just as bad if you no somebody they will give you better seats upgrade you for free all in all crap
mohammed k,I have to fly this airway because it is a direct flight.if I had a choice I would not step foot on one of there airplanes the planes are old seats don't always recline tv don't work food is crap always take my own food with me.
Dirk W,"We had an early 7.15 morning flight, so you get up at 4.30 to get in time to the airport. Once there, flight cancelled ! No email, no SMS, nothing. Weather conditions were perfect, so clearly, the flight is cancelled because of insufficient travelers. After this shocking experience, we had a further two flights with PIA and got stuffed around even more. PIA has got the monopoly for domestic flights and shows no respect for their customers. Competition badly needed !!"
andymatson,"PIA always my best selection, its direct, its my Country's only Govt own airline. It gives feels of being home. I am sure they have made significant improvement. There is always room for improvement but I would travel with them regardless anyday, Food wise, i do not need to worry about Halal food as its understood. No alcohol-all features make you feel at home."
maz20162017,"flight left 3 hours late from London Heathrow to Lahore Pakistan due to heavy fog in Lahore, small old aircraft no entertainment whole entertainment system was down, typical airline food, Apart from this, a good direct flight at a very cheap price."
amber t,"flight was pleasant, crew showed hospitality but crew was above age to smile enough. it is advised that a more smarter crew should be arranged."
taquir,It was a surprisingly very good experience in travelling Business Class from Karachi to UK and back. Both flights were on time and the atmosphere in the cabin was good with good selection of meals and service by the cabin crew. The only exception was in-flight entertainment which was not functioning. The whole experience was worth the price being charged by PIA as compared to other airlines on this route.
Teymoore,"If you are travelling domestic, then PIA is no doubt the best Airline that covers almost every region and multiple flights during the day than any other domestic carrier They need to improve on the meals though as per their airfare Staff is hospitable but not energetic :) Planes are nicely maintained but needs more attention They need to provide in-flight entertainment which is not present at the moment"
Aijaz S,Flight was on time and it was cheapest flight to compare with other airlines BUT yes when you save money so no fun at all!!!!
Faran Rasheed,"Most of the time the flights are delayed, but you can trust the professional pilots with smooth flight and takeoff/landing."
470kashifs,PIA is my preferred choice of flight because of the smooth take off and landing. Excellent service in terms of flight operations.
ZaimJee,I had flown with PIA after so many years and it was an amazing experience. Even though it was short Domestic Flight from Lahore to Karachi but I was simply amazed by the improved service and quality. The Flight was right on time and landed on time as well. The in flight service was very nice with smiling staff
Sukena R,"I had heard many horror stories about the national carrier, but they didn't disappoint at all. I got a 40% off my ticket, earned miles, and the crew was very professional. The flight was smooth, direct, and highly recommended. PIA is now regularly offering many discounts and offers, and the service is good too. I highly recommend looking into their international flights."
mgtprofessor,"PIA is a Pakistan government owned airline. I took the flight on PIA from Toronto Canada to Islamabad Pakistan in December 2017. The flight was direct and took about 12 hours. The airline business class was clean and stewards and stewardesses were polite, professional, and helpful. The flight was on time and without any incident. The toilets were clean and had all the accessories. The food was good and had a variety to choose from. My luggage arrived in good condition. The seats expands like a bed which allows for a comfortable sleep. Since I fly once a year to Pakistan using different airlines, I think PIA is very similar to Turkish and Etihad airlines both in service and comfort. PIA, however, is direct and always arrives on time or ahead of schedule. I highly recommend this flight."
madmasai,Alhamdulillah the best highlights of the flight was the pilot landed in zero visibility and heavy fog without a bump apart from that its the quickest way to get home although the safety and the services on board are questionable the service on the plane was of low standard food in short supply had to keep on asking for services no amusement on board systems failure
Usman Sabir,I think this is the best service route of PIA. - Tickets are reasonable and price fluctuation is non existence. -Delays dues to Fog in winters is unlikely due to flight timing. - Flight timings suits tourists as the arrival time is 12am and departure time is 1pm at DXB. So its easy for a timely hotel check-in and check-out Overall great value for money
Michael D,"Was flying from Tokyo via Beijing, with a connecting flight to Islamabad, then on to Riyadh. Put up in Narita's Japan Airlines First Class Lounge - Excellent Lounge, one of the best! Flight delayed by 2 hours. Once on board delayed again, so the cabin crew, always attentive, offered a full meal pre-flight... We arrived in Beijing with torrential rain, parked on the apron, not a gate, so no-one allowed off the plane unless Beijing was their destination...cabin crew were again great, no problem, more food and drinks proffered. Worried that I'd miss my connecting flight from Islamabad to Riyadh, and the flight did indeed arrive very late to Islamabad. To make things worse, or so it seemed, there was no 'Transit' lane at Islamabad AP - all must generally exit the airport through immigration - and of course I didn't have an entry/exit visa! Again, the PIA staff came to my rescue, escorted me out of the arrivals hall, out through immigration and customs, back through customs and immigration, and back in to the departure hall! With half an hour to spare to board my flight. But as luck would have it, my flight to Riyadh had also been delayed, so had time to relax over a chai before boarding. So, as said, delays are common, though in my experience rarely cause major problems as PIA staff are excellent. More just a bit of excitement and in the end, fun. I can't speak highly enough of all the staff, and the price for my business class flight was half the price of 'more recognised' international airlines! If you have the time and don't mind the odd delay, well worth trying PIA out."
JJJJJ2013,"First, bad experience was worst delayed flight without notice and then a really old and very very dirty bus was used to transport us to aircraft. That was just Okay. The food was old and low quality. The second time I booked same flight and they booked two tickets in my name. I asked them to cancel one as one person can fly on one ticket only. They said I have to pay cancellation charges. I paid and said goodbye to PIA. PIA, Never Again."
Zahid K,"I just couldn't believe the staff asked me £120 for a £5 for a walking stick treating it as a luggage piece,The supervisor even backed it up speaking from his Gand with out checking what the check in staff asked for"
xman7520000,"Due to a last minute trip, decided to book PIA from Paris to Karachi via Islamabad. A few hours after the booking was done we recieved a call from PIA to reconfirm the details, during the conversation we asked if we could hold our seats. The person asked our preference and we said in front of the plane. We were pleasantly surprised to find out that we were given business seats all the way from Paris to Karachi. Being a long haul flight, the seats were really handy due to more room and leg space. The inflight service was same as economy. The staff was not very usefull as i demanded for a blanket 2 to 3 times but they never gave me one during the whole night flight. Also they were really not bothered about the passangers and were very loud and noisy throughout the night. On the way back we tried to pay and get an upgrade but the flight being full wasn’t possible. The way back was the most horrible flight i have ever encountered in my travel history. Being economy no complaints for the leg space, it was alright. The flight was overcrowded with infants and children who were screaming and crying all the way throughtout the flight and that which was for 9 to 10 hours!!! The flight screens were not working at all , all of them were dead hence there was no inflight entertainment and so couldn’t even watch something to avoid all the outside noise. There was a child aged 7-9 years of age seated in the front of my seat who was a complete nuisance. I can understand children getting cranky but this one was a compelete pain. She was banging the back of her seat with her head and back, screaming her lungs out and kicking the seat in front of her, due to which her seat was constantly banging and hurting my knees. The mother was least bit bothered!! A horrible way to end a hectic journey, was just glad to rush out of the plane. PIA hopefully never again!!!"
Yusuf Moosa,"This was my first time after many years I stopped to travel by PIA due to a very bad experience with it. Anyway I have to travel on a Friday and there was no option except PIA. The same services nothing changed in more than two decades. Food quality not eatable, soft drinks was without any taste and the tea was anything but not tea. Air hostesses dress and look very poor. The only positive thing was that our flight arrived on time."
One_Bangali,"This ageing airline is just mediocre with fares that are not competitive. Ticket prices are ridiculously high. When I traveled with them, the plane was not clean and the food served was of poor quality. As I entered the plane there was a horrid stench! The plane felt humid and smelt like someone had vomited! The seat felt hard like a rock and did not seem to be maintained at all. Some seats were creaky too! Scattered all over the plane were handkerchiefs, diapers, cups, discarded tissues and other rubbish on the floor! The in-flight entertainment system did not work and the content in the few adjacent screens that worked seemed hopeless anyway. Most of the LCD screens where not working however. A “Windows Corrupted” message was displayed instead. The cabin crew were so unprofessional. They don’t even speak to you politely. I saw a male cabin crew literally yelling at a passenger! I requested a blanket but I was told that there are only a few blankets and so I cannot expect to get one. Plus if you complain, you will never get a proper response. One of the expatriate Pakistani passengers sitting close to me was quietly fuming about how foul the smell inside was; how filthy the plane was; how unpleasant the staff were; how despicable the service was; and how shocking the customer service at the airline counter was! Furthermore, Pakistan International Airlines were horrible people to fly with he said! The only plus side was that the flight was punctual and on time. However, this only happens on rare occasions, I was told. Pakistan International Airlines could do more to improve its service, food, planes, staff and etiquette of its cabin crew."
Shafiq S,I will never ever will fly on this airline at all. Plus you make complaint there will never come back with any response . This is budget airline people don't get fool.
MUAZZAM ALI,"Excellent and cheap airline to travel abroad and within Pakistan. Food, staff and comfort is good. A pleasant journey."
Muttaqi,Well improved services and air crafts. Excellent pilots and staff. In flight information was good. Keep updated your self on weather issues.
Haamid J,"Northern Area flights are subject to weather and visibility. We were fortunate both ways to and return from Skardu our flights were on time. The delightful part of this sector is that you get to see the most beautiful terrain and natural beauty from 10,000 meters. Nanga Parbat in its full glory can be seen going to Skardu on the right side of the plane - get a window seat on the right side facing the front. On return the opposite side."
Kamal5372,"Being the only flight operating between Karachi and Gwadar, you have no other option. However, PIA could improve its punctuality, service, food stuff and courtesy of its cabin crew. The only good thing about it is that you don't have to travel by road for 7-8 hours!"
Saad S,"It used to be one of the best airlines in the world . Poor maintenance and lackluster management made it to the lower ranks. Planes and its cabins are old even business class seas though spacious , are a bit rusty . Good thing about this airline is its service in business class which and its food if you got a taste for Pakistani or Indian cuisine. Hopefully they will upgrade their feel improve soon otherwise they will drop to the list of worlds worst airline like Indian airlines just went"
flyfisher66,"First, we were told that the flight will now board at 8 am instead of 10 am. It was a minor inconvenience but we made it to the Skardu Airport well in time. Around 10 am we were told that the flight from Islamabad to Skardu has been cancelled due to bad weather. We asked the airline staff, ""What next? Will we be accommodated in the next flight? ""Sorry, all flight in next week are fully booked"" was the reply. We were horrified to listen this. There were over 100 of us and we had nowhere to go and the only option left to us was to take an 18 hours road journey to Islamabad. Many of the travelers got furious and told the airline staff that they have to adjust us in the coming flights but airline staff closed the window and disappeared advising us that we can claim our refund from Islamabad. This was absolutely disgusting and I never had such an experience in the past. Cancellation / delays in the airflights due to bad weather in Northern Areas of Pakistan is not something unusual and I have experienced it many times in the past. However, never before PIA abandoned us like this. We were always adjusted in the flights on next day or later or were offered a quick refund. Many times PIA flies an extra flight on the same day to accommodate the left over travelers. It seems to me that now there is no accountability at any level in Pakistan International Airlines. Too bad."
Khatpandwa,"Competent staff, smooth flight, good food, blah blah blah blah blah blah blah blah blah Over all enjoyed this flight along with my family"
Bee A,"If you fly domestically in Pakistan, choose none other than PIA. Despite all the incompetency of the government and inefficient operations, this airline still is one of the most consistent performers in the domestic circuit. On international circuits, this airline is just mediocre with noncompetitive fares which gives the edge to other quality airlines. I would still blindly book PIA for my domestic routes."
Dijas-123,My flight was delayed initially by 3 hours which then turned to 7 hours. The communication to passengers was very poor. There was no representatives around to tell anyone what was going on. Eventually we boarded the flight but it was another 1.5 hours before take off. The plane itself wasnt cleaned and the food served was of poor quality as usual. Thr price of tickets is always ridiculously high. I have promised never to fly with PIA again.
liverpoolLiverpool21,"I booked 4 seats for myself and 3 children on flight PK 721 , 9th August from Manchester to New York and upon arrival at the check in desk was advised I couldn’t fly as I had no return flights booked. This was not mentioned at all during the booking process and I was forced to quickly go to the internet and book return flights before we could check in. When I returned to the check in desk we were advised after a very long wait that there were no seats together but not to worry we could speak with staff at the boarding gate who would help us as they did have a block of 4 together in business class and could move passengers around. The staff at the boarding gate laughed and dismissed me saying this is not possible and advised me to speak with the cabin crew who were even less interested and passed us from one staff to the next trying to sit my 5 year old and 10 year old together at the front of the plane with no adult to look after them and myself in the middle of the plane with my other daughter at the back of the plane alone. I advised the staff this was not acceptable and they told me to just sit down and they would try to move us around once the plane took off ! All the passengers by this time were staring at us and we were made to feel extremely uncomfortable. After several more complaints regarding my children being expected to sit alone with no one to care for them I was begrudgingly given 3 seats together for the 4 of us to share and advised it was the best they could do as the whole flight was full and they didn’t have to accommodate us , they were doing this from kindness !! I was not given any seat belt for the 5 year old I now had sitting on my knee for the whole journey which was not safe and we were just disregarded and frowned upon , I felt we were treated like animals and left extremely uncomfortable for the whole flight. I have raised several formal complaint regarding this matter and to date not been resolved and in fact communication has ceased their end. These flights cost me nearly £1400 one way for the worst experience and most unsafe journey we have ever encountered which gave us a very unpleasant start to our holiday."
ZaimJee,I had traveled with airlines few times for domestic business trips only within Pakistan. Overall average service since the journey distance is very short
Rasheed A,I fly last sunday with pk 0283 everything perpect specially thanks to all crew member but the faisal is very kind respectable host and has colleague also very silently doing has jobs I like this services and I hopes they will keep it up for next time.
Heng How N,"The flight was on 7:15am. Left the hotel 10 minutes before 6:00am and reach the airport at about 6:15am. Check in at counter without much issue at straight to gate 4 for the flight but the gate is not opened for PK390 yet. Once ready, took the bus to the ATR 42 aircraft which is a turboprop plane. Climbed up the small staircase up to the aircraft. Once with the clearance, the flight took off smoothly except the aircon is not cold, or the air came out is warm. Awhile later, the crew serve us with a light snacks with drink. There is no hot drink available. About a hour, the pilots prepared to land on destination airport with ease. Again came down from a narrow staircase and walked towards the luggage claim hall or arrival hall. Wait for awhile and the luggage was on the belt for collection. Out we go for the site/plant."
adss1230,"It's a pretty decent airline and that's about it... PIA has been overtaken by airlines like Emirates and Etihad that have far more superior service and a better product overall. I have heard they give sometimes better deals than the other Gulf carriers, but I think there is a much better experience on any other airline traveling to Pakistan, like Emirates or Etihad. Seats are relatively comfortable, but little variety on in-flight meals. IFE is kinda outdated and the entire cabin product needs a little fresh update overall. Decent airline, but there are better options..."
bluetauras,last min check in they still accommodate me and also upgrade free in business class . 😊 the crew is very nice and experience is great . the breakfast serve with love and care. food is fresh and hot and tasty . Really appreciated.
bluetauras,it is 2nd travel in last six month with PIA. experience is very nice although I heard bad reputation a lot about this airline But every thing is entirely different.it is very good . the flight is on time how so ever there is heavy rain and bad. the staff is courteous. the meal is free fresh and warm with huge smile of staff. Arrival is also good. There is no issue at all. I strongly recommend .
UlsterFryNo1,"When you fly to Skardu, you have to be prepared to take a day or two longer there if the weather's bad. That's what happened to us... not PIA's fault. However, I don't know what we would have done if we hadn't had a local tour guide with us who could get to the head of the queue in the PIA office in Skardu. I would have been totally lost. When we did leave the next day, the flight was perfectly fine."
slapshot81,"I bought a DIRECT flight to Lahore. I was suspicious about the timings that just didn't match the 3.5 hour flight time but paid it no attention. Plane landed, I stood up to disembark and the stewardess came running over over to me.... Stewardess : ""Excuse me sir.... You are for Lahore right?"" Me : ""Yes that's right. Are we not in Lahore?"" Stewardess: ""No sir, this Peshawar. Please take your seat and we will depart for Lahore in 30 minutes"". Me : ""Hang on, this is supposed to be a direct flight to Lahore.... What the hell is going on""?!! Stewardess : ""This is a direct flight sir, via Peshawar""! There was nothing I could do or say so I just went with it. In short, you will need A LOT of patience to fly PIA. Good luck to you!"
AQ2012,"I had my reservations for flying by PIA since in recent times a negative image has been portraying about it. I wanted to fly nonstop and this was the only airline flying from Manchester to Islamabad, so I decided to give it a try. It was a nice surprise. The flight was in time. The on board service was superb. The plane was comfortable. Food was good and all Halal. Plane was neat and clean. Toilets were neat and clean and remained clean till we reached Islamabad. Baggage allowance was more then other airlines.The flight was smooth and comfortable Karachi and back to Islamabad by PIA. Returned back to Manchester by PIA. All the flights were superb, comfortable and the customers were looked after very well. ,"
"Shah, Tayyeb","Although PIA is underrated by many people for their services and time, but my personal experience was totally different. The flight I flew with, was in time, comfortable, the seat was also comfortable, the menu was great and the boarding was free of hassle. I would recommend this airline not only for domestic flights but also for international flights."
