Reviewer,Review
arcticantipodean,"PIAC lost my baggage on January 2, 2020 on PK786/894, LHR-ISB-KUL. The baggage never arrived in KUL. PIAC have taken no action to pay me the compensation I am owed and have remained uncommunicative in the ten months since this incident. Absolutely the worst airline I have ever dealt with in over 30 years of travelling around the world."
Haseeb,"I was very happy when I planned my vacation and thought to surprise my family.. but unfortunately when I went to the airport I found out flight is delayed for 4 hours. Flight took off around 6pm Pakistan time so it was not surprise anymore because I have to inform my family members as I was arriving very late at night. Secondly no social distance was maintained and 777 was totally full with passengers. Third thing Air condition was on its full speed and it was chilling in the plane, cannot understand that in summer AC doesn’t work or they don’t switched it ON and in winters it was on full speed. I requested Cabin crew couple of times and every time they told me the same answer that yes we will reduce now but did nothing. Finally I took out my jacket from my hand carry luggage and managed to cover myself for the rest of the flight duration. Cabin crew Age was almost the age of my parents and Male cabin crew specially was so unprofessional, looks like they are at that stage of their career when they don’t give a damn about anything like take it or leave it. At the end my I would clearly mention that my purpose is not to disregard my National carrier but until when these things will be stopped?? I would really request Mr. Arshad Malik to save our national carrier from this disaster service. Look into these kind of matters, why flight is delayed every single time we travel with PIA? Why Cabin crew are so unprofessional? Why we can’t be proud of our National airline? Being honest this is my last time I travelled with PIA and will stick to my decision until these kind of stupid issues will not be resolved."
Mina S,"This is the worst airline in the world. It took me $4,000 to get them to book an ECONOMY FLIGHT. In the middle of a pandemic. where other airlines are being accommodating PIA is seeing this as a business opportunity and up-selling everything."
Sean,One of the worst customer service I heard a crew member calling a passenger a bastard. I was shocked drinks limited seats has dust on them. No entertainment Very unsafe plane to travel on. Alot of passengers were complaining but staff just never take notice very ignorant. I even took an interview from them on my phone. For desperdaise channel. Habib Mirza
Hamza,"Dangerous flight, asked for blanket was told they ran out asked for water told it was run out what kind of service is this"
Ahad M,"This was the worst experience with an airline that I have ever had in my entire life. Going to be quick and say,"" DO NOT BOOK ON THIS AIRLINE!!!"" WHY? because inside their planes the TV does not work, food is terrible and workers are very rude. The worst thing that they did is tell me 5 days prior to out flight that it has been cancelled then later we got a phone call from our travel agent who said that the flight wasn't cancelled but our seats were. So they took our seats that we booked 6 months ago and gave it to someone else for double the price. THEY SCAMMED US!!! THE ACTUAL PIA SCAMMED US. So what should you guys do? go with any other airline even if it takes 50 hours longer still these idiots aren't worth it!!!"
Assassin S,Worst airline. i hope government ban this stupid airline. The title should be change from come fly with us to come die with us.
Bismah Saif,"Reasonable fare, good in flight service, landing and take off on time. Provides direct trips to most destinations is a best part. Pakistan Zindabad."
Dua,"If you wanna alive so dont travel in PIA flights, even in domestic flight also. Conditions of aeroplanes are so poor so better to avoid flight in PIA. Your life is important dont make your life in trouble and the evidence is in front of our eyes,3 horrible plane crashes and today's one happened from lhr to khi airline flight. So be safe and be happy and avoid journey in PIA."
Zan H,"hi every one just want to let you all know I been trivel in PK-8757 pia airways in may 2020 was not save flight at all fill like thay not going to make it to London Heathrow airport that how Fill's like bet thanks to god it's when all OK thay have change me to much and pia airways was solo durty from in side it's was full off shirt & staff was not helpful at all staff was so rude,I only stay in airways I have to see my family and kids thay way other way I will get out pia air ways naver have this expected this at all thay service was sloop down and air bus was seats was full off 💩 helt off pia air bus like any time will drop down I was just been playing all the time god get me home save thanks god we make it save to London I don't understand how gourmands let tham fly not safety at all for pasngers....."
Kalandar123,"The most Rubbish unprofessional airline anyone can ever travel, no comments to the cabin crew as they can't provide food if the management will not give or working TVs concidering it's a hard time for everyone Pia found the chance to over charge take advantage of ppl being stuck and then keeping them hungry for 8hours. Whoever the director is of this airline you will have to answer to Allah SWT do your very best in scamming ppl and keeping them hungry wait till Allah SWT shows you how it is."
Ateeb R,"Firstly, why is there no button to give 0 star rating, even a 1 star is too much credit to give for this joke Airline.Absolute disgrace, only had to use out of emergency (covid19) and not to do with choice.For the amount of money these thieves make you'd expect a half decent plane but instead you get a plane that probably hasn't been cleaned since 1996 (I say this as I was a young kid, who travelled PIA that year). My parents paid so I had no choice.Side note: No procedures in respect of Covid19. My family of 5 including 2 children 3 and 6 were split up and put next to random people, that's a great way of containing a disease isn't it?If you have half a brain cell you would NEVER use this airline until they sort their attitude and service out. Stop making them money, use any other airlines, I'd rather walk to be honest then use PIA.I for one will never ever set foot in a PIA plane again. Stay safe people."
MASSAGE THERAPI... M,"Being s patriot, I decided to fly through this operator but, faced disappointment. They cancelled my flight thrice with no legit reason.Then, I had to book other airline on urgent basis. I did not even asked them for refund due to frustration :/ God bless you :)"
Muhammad A,"Payed almost 900 dollars for a single ticket and it actually cost around 500-550 dollars. I was one of those specials flights. 1. It as 3 hours late because they couldnt find the cabin crew 2. I wont blame they cabin crew bad for service becaue of this epidemic but they were sloppy with other procedures. Planes was about to start accelerating on main runway but overhead compartments were still open, i had to get up and shut around 6-7 compartments. 3. No flight entertainment 4. Seats were in bad condition and food was bad. (BUT THERE WAS MORE LEG ROOM THAN QATAR) 5. But i have to compliment the Pilots, they were superb, i usually have earpain while descend and landing but this time not a thing. 6. They allow 46KG per bag so thats a plus. I will recommend PIA solely because of flying quality and 46kg other than that NOTHING"
Zaf R,"Old planes , old seats , service is crap but they do try to rob you at every point ..wouldn't bother flying with and it's the right time for it to go bankrupt . People need to wake up also they took massive advantage of the covid ..baaad PIA"
Fazal A,THE EXPRESS TRIBUNE > TECHNOLOGY Instagram's CEO is managing the billion-user network from his garage
lubz_313,"I am severely disgusted in PIA for the way in which they have handled the crisis of COVID-19. Having cancelled all of their flights upto April 5th, they have not sent out any confirmation e-mails regarding this. When I rang the airline contact centre in Islamabad, I spoke to Sameer Ali on 26.03.2020 at 4.42pm who told me my flight has been cancelled however they will not book me and my father onto the emergency flights leaving the same date (29.03) and same time (11.50am) as our original flights. When I queried why, he just told me he could not. I asked to speak to his manager which he refused and also would not provide me with his managers name. I further asked him for a confirmation e-mail my flights have been cancelled and he refused to do this. He then went on to cut the call on me. I am so disgusted this is the kind of service PIA provide to it's loyal customers. Do not ever book with this disgusting airline again, they will rob you of your money and then when it comes down to solving problems they will vanish on you."
Shazia A,"Though the airbus was a very old model and noise level was a little high, the leg room even in economy is quite big. Choice in food may be restricted, the staff was friendly."
Deh G,Absolutely disgusting. Being a pakistani with a bristish passport security ripped bags open threw everything no respect at all was told to boqrd without bags have no idea if bags are going to be there when i land absolutely digraceful service on the plane too. There was flies on the plane
Malik29,"I flew with this airline back when i was heading to pk. And not only that the plane was like 7-8 hrs late. They had really rude flight Crew attending. Specielly the Ladies, nothing Works on board like the small screens infront of u or the audio, so all u Can do is to bore ur self during the the loooooong hrs in the Air. And now they wont accept that the broke the refund law so they are trying to run away from that to. Cant recommend to anyone. Seek other ways to fly to Pakistan then this."
L Z,Baggage allowed is 30Kg with 1 piece. My dad is 72 years old. Would you mind telling that 70+ people and females will be able to carry 30kgs in on go. You guys need some serious coaching for policy formulation. Pathetic people pathetic service 😡😡😠 PIA
Suhail A,Planning to travel to Lahore for a short visit and booked a ticket well before. Received a phone call 30 hours before that seat is cancelled in Lahore flight and given a seat to Sialkot flight with no other options. Wasted a day in our holiday and reached a destination which is 170 km away without an offering of a transport. We have hired a private taxi to reach Lahore next day. Better to go with other alternatives flights with a stop over in the middle east.
Shehryar Sikandar,"The timings of the flight was great, at 9 pm and gave me more time to spend at London rather than other airlines which depart at night. Arrived 16 minutes earlier. There was no IFES but the inflight magazine made up for it by some extent. The inflight food was good, with the desert being my favorite part. The plane on the other hand wasn't clear from both, the outside and inside. The bathrooms had stickers to hide the damages on the plane's body. The stewards were polite and spoke softly. The seats plain terrible and their covers could easily be removed. Overall, I had an ok flight. If I were short on time, I would definitely use PIA due to non-stop flights and good punctuality on International flights. Yet if my main concern was to be switched towards luxury, I would choose the middle east trio airlines."
Shahid A,no onboard entertainment on way to Lahore or way back as no screens worked seemed they haven't paid their tv licence by the looks of things and the pilot didn't speak at all even to tell the staff to take their seats for landing as we could of been in Nigeria for all we know very poor overall and sad as wanted to support our carrier but not again I'm afraid
FM111,I would not recommend this airline Because it has the worst customer service plus the seats are broken and the tables are still dirty it was horrible experience and I will not be coming back on PIA The food was not properly cooked and the staff was very rude towards the members of the public please avoid this at all times this is not worth even going on to Not only that halfway through my journey from Birmingham Airport to Islamabad there were no toilet facilities such as toilet papers and water to wash your hands with staff members do not know how this was not working. As you can understand on a 8.5 hour flight this is unhygienic and below human right standards No apology was issued at any point during the trip or even after.
Cara A,"So, I must admit I was a little worried that I had booked my flights on PIA, but must say I was pleasantly surprised at the service. The service and food were great.It is clear to see the airline is working hard to improve it’s service and the staff seem to have undergone training, as they were so very helpfully, saying that “we are there guests and nothing is too much trouble”, this made for a pleasant journey. Although the TV screens don’t work yet, they are working towards improving the fleet. For the price paid - a direct flight was well worth it. I would fly with PIA again."
Riaz A,"Worst experience flying with PIA TV and charging device was not working almost 14 hours flight like sitting in jail. Washroom was horrible and flooding, can\’t eat food"
786mkhan,"Took this flight with my family and diabled mother, needed a direct flight. Flight delayed, while awaiting to board the flight the captain sat next to me and I asked if service had improved and if the plane was a newer one, 'Yes the service has improved hugely the planes are really good'. I did chuckle for a moment, but thought its been 15yrs since flying PIA, may have improved. 1st on the plane and the toilet bleach smell was the first thing that hit me, so many seats with such little legroom, Looked at my 15 yr old whos used to travelling on Emirates, his smile disappeared. We got to our seats we were sat close together but no inflight entertainment, most seats were broken, old and tatty, no legroom and really unclean plane all over. Food was ok 3/5 as the attendant mentioned the food was prepared in Manchester so was average, he told me the return flight food would be rubbish. We had got plenty of sani, sweets, chocs from Manchester on the off chance. Once food served flight crew non existant. Toilets had no hot water and when I queried this the crew member just shook his shoulders. PIA is really behind the times and really outdated, Im surprised so many still fly with them, I can only think as its direct. When I read other reviews from people from around the world about there experiences on flights complaining about basic things like, not enough drinks served, crew to busy to look after them, not getting a free upgrade etc, they all need to fly PIA and they will realise they are in heaven. Oh yeah our plane had mood lighting, stars in the sky, why have that updated when everything else including the plane are so dated. Please avoid where possible, fly emirates, etihad, Oman, Kuwait, Qatar they all have new planes."
mairashah2018,such a pathetic service ... pathetic food... rude staff... i think pia is the only airline who hires the women in their retirement age....who are already fedup of their lives ..didnt have screens ..ot even the bigger one on front.. u can't say where are u going where have u reached and what time is it....never going to choose pia ever again.
Arbab,"Thanks PIA, I have Traveled on Pk786 Dated 15th Dec 2019 London-Islamabad with Human remain. Due poor visibility at Islamabad flight diverted and Landed at Lahore airport. The dead body was belongs to Lahore and i was going to take it to Lahore via ambulance. After flight landed at Lahore Airport I contact PIA staff, explain the the situation and requested to let me Exit at Lahore instead of Islamabad. One of the crew member Mr Asad contacted a Senior Officer of PIA Shuaib Khan at Lahore airport who help me very much and make extra efforts for Off loading me with Human Remain, in a very short period of time he done the arrangement to fulfill immigration requirements as well as to deal with cargo to help me to off load at Lahore. He also guide me to the Cargo Terminal and explain the whole process which i was no aware off. He also helped to off another family of death case who belongs to Jehlum and requests for Off loading in Lahore. Here I also mention a cargo staff who also help me in all process of clearing human remain from cargo. I along with the relatives of Human remain are very thankful to these competent officers who are very caring and helping, I also Thankful to PIA Management who Improve the services. What PIA have done for me on that day, I will never be able to pay back. Thank you PIA. Thank you M Shuaib Khan, Mr Asad and cargo service."
Waqar Hussain Shah,"In my 10 years of stay in UAE, I have never used PIA services but this time just because of patriotism I booked this flight and traveling with my family. My flight PK203 supposed to fly at 01:50pm on 16th January 2020 and I got a call early in the morning that flight is delayed because of some technical issues and they don’t even know what what is that technical issue and the new time is 11:50pm now. I got furious at first but then controlled myself and didnt say anything to that agent as it’s not his fault. Later around 9 I took the taxi and reached at the airport at 9:45pm and upon reaching I came to know that flight is delayed for more 4 hours and now it will fly at 03:30am and the most ridiculous thing is they didnt even inform me this time. This is the most pathetic experience with any flight I’ve ever had and TO BE VERY HONEST I REGRET MY DECISION TO TAKE THIS FLIGHT AND IM SAD THAT I WONT RECOMMEND THIS TO ANYONE AT ALL AND EVEN I WONT FLY VIA PIA EVER IN MY LIFE AGAIN. Im out!!!!!!"
Hedia A,Although the flight was delayed 5 hours I do not rate the company less than 8 as cabin crew I appreciate that the delay was due to weather condition and thick fog and delighted that it was not cancelled. Free meal voucher was issued for all passengers and great care at the airport for all passengers. Food on board is free and drinks round was twice served as well as extra water and tea and coffee Staff quiet caring as they were aware of delays and how passengers are tired. Leg room is good and toilets kept well clean throughout the flight.
Abdul Moeed,Pride of Pakistan. Had a lovely expereince with them. Flew from Islamabad to Doha Qatar. Had a lovely expereince. Food was good and service was good too. Will recommend it to others. Cannot wait to fly with them again.
hafiz hasnain s,Last 3 years I didn\’t use PIA. But that time due to non availability. I book with PIA. After boarding I thoughti will b late. But when I heard announcement I was really shocked it’s on time. During flight they inform we will b land before 30 mints. I was like what happen it that PIA. Then I check with some travel agents Now PIA is going Good. Because of new professional management. I pray for PIA. God bless the staff and management. I wish PIA become again number 1. InshaAllah Because it’s our Brand our pride.
Yasir Ali,Regular flying with PIA since 2018 and the service and food is great and tasty. I am proud to say the PIA is the safe airline in the world Just the entertainment need to upgrade and hope PIA will look into it in near future . Very pleasant and comfort flight. 💯
TravelSchah,"I am really sad to write this review. After watching all these promotional content and improvement projection from Pakistan International Airlines and Air Marshal Arshad Mahmood Malik I was really excited to fly with my very first PIA flight. My trip was from Abu Dhabi to Islamabad PK 296, Lahore to Karachi PK 313 and then Karachi to Abu Dhabi PK 4222. We were planning to go to attend my best friend\’s wedding. My friend\’s and I never flew before with PIA, for the obvious reasons (bad performance and terrible customer handling in the past). Unfortunately, this boat drowned leaving very bad impressions. I am a frequent traveler and a Travel Photo blogger, ref: @travelschah I do not like to write negative about services but I always love to share my experiences. During the flight from Abu Dhabi, when I entered in the aircraft, it had a worst smell in aircraft. My flight was booked but neither anyone mentioned to me that on domestic flight baggage is reduced nor in the email. My baggage was as per my international flight allowance. Which was reduced to 20kg without my knowledge. If I am flying from Abu Dhabi to Islamabad with 29kg of baggage, where I am supposed to leave the rest of 9 kg to fly with your unscheduled flight? But at the check in counter, Mr Haider misbehaved and literally shouted on me. I was impressed with such of wonderful PIA hospitality. Then I was handed over to Mr. Gondal who took me to ticketing section and without resolving issue left me there with Mr Ali Furqan (ticketing guy). Mr. Gondal asked Mr Furqan to check the ticket and confirm if I am not wrong. Mr. Furqan informed Mr. Gondal that fault is not from my side, it is their ticketing issue from Abu Dhabi. Mr. Gondal informed me he cannot help me out and I will have yo talk to Terminal Managar Mr. Chaudhry. They informed Mr. Chaudhry that its fault from ticketing. But Mr. Chaudhry said I can apologize the ticketing agency\’s fault and then clearly refused to help me. He was telling me stories how airline is firing people without any justification these days and this is why he cannot provide help to the passengers he need to keep his performance sheet clean. I didn\’t understand how you can prove your performance while leaving passengers devastated.At the end I had to pay extra for the baggage which was 5800 PKR. Not a big deal. I came back to the counter and collected my boarding. While leaving the check in counter, I heard Mr. Choudhry talking to a Young lady who\’s mother was on a wheel chair, who also has 7 kg of access baggage, that wait on a side he is gonna help her resolving an issue. I am sorry for ear dropping here but then I had to interrupt and ask Mr. Nice and gentle Choudhry that my access baggage was 4 kilo I had to pay 5800 extra while she has got 7, how you gonna resolve her problem not mine while you are eager to give her favor for nothing and my ticket was a poor performance of your smart ticketing office. While talking to Mr. Choudhry, girl ask me to stay out of THEIR matter. But eventually she also had to pay because I was not interested to leave until she receive the same treatment as I had. Leaving the issue behind, flight which was supposed to take off at 0800 on 30-Dec-2019 was rescheduled to 1200, later to 1400, 16:15 and then 1800 PST. It left everyone in frustration too. I had asked Mr. Choudhry that flight is more than 6 hours delayed now, what are the compensations for passengers, he angrily said, we are giving you lunch what else you want. While in departures food was without any thing to drink, no water or soft drinks. Let me remind you PIA is one of the member signee of The Montreal Convention which reserve the rights of passengers. As reference: \“In case of flight delay of more than 2 to 4 hours (in proportion to flight distance), the airline shall serve refreshments / meals to passengers (according to time of day) and offer communication facilities & hotel accommodation for the night when necessary (e.g. transit passengers / outstation passengers who do not have own accommodation). [ Article D 12.2.5 & D14 of ANO-001-ATCP-2.0]” I was an outstation passenger and I was not accommodated in anything. Which was strange for me. No hotel, no refreshments. Later came the food, without water. I ask the guy over the reception if he has got some water, he said we are out of water, go drink from the tap, he pointed me towards a water plant. We second part of it, “ When the delay is more than 5 hours and the passenger decides to discontinue his journey with the airline, the airline shall offer full refund of the unutilized ticket. [Article D 13.4 & D14 of ANO-001-ATCP-2.0]” While I was told there is a next flight for you so we can not refund”. I had my mother’s appointment with a doctor at South City Hospital Karachi. Thanks to PIA my mother had to miss the appointment because I couldn’t make it to Karachi.  I was so excited to travel with PIA, as I am a big supporter of National Institutes. But it turned into a worst nightmare. At the end I would like to close by addressing CEO PIA, Mr Arshad Mahmoud Malik that sir you are struggling with hardware, we can understand but what happened to basic customer handling skills? Not taught by PIA, I am talking about the real basics, taught by our parents. Where is the compassion? Where is the passion of this world class airline? Because this is the service standard which PIA possess at the moment. They have no respect to people And flight schedule what-so-ever. I am really sad to say that: “A big boo and shame on PIA“"
Azam,"Frequent flight delays - really long ones - baggage claim and cleanliness of the aircraft are some of the major issues - Our flight was via Lahore, the airport is in a pathetic state - Dirty, filthy, no maintenance, people smoking in the hall way - and much more ! Being in 2020 there is no flight entertainment - we still have a long way to go - the fares are not cheap by the way - there is no value for money - let’s hope more drastic steps are taken to improve the overall experience- Islamabad airport being new is nice 😊"
parveez s,Coming back I had temperature and I was looked after very well by the in cabin staff. Got lots of tea.food was excellent. Will recommend always.
