Reviewer,Review
sabina_23,"Just came back from lahore Pakistan with three young children going from Heathrow was okay staff were helpful but noting else much going on. Coming back to Heathrow was a horrible experience for the whole family. No screens were working if you were lucky enough to have a tv screen work they don't supply headphones😣. No blankets or pillows were on board so my children were uncomfortable and cold throughout the whole 8 hours flight back. Food was sooo chilli not even I could eat it let alone children, no food option is given so either eat it or starve. Drinks were brought only with dinner. My 8 year old son was sitting next to a old lady who was constantly coughing so kept asking my son to get her water he was told "" you have been 3 times already asking for drinks WE DON'T WANT TO SEE YOU AGAIN HERE"" even though he explained it's for someone else they didn't give a damn. Staff closed the curtains and sat there throughout the flight gossiping behind if you want something you will need to get up and walk to them. I had two young kids 2 and 4 aswell who were so bored and hungry. Toilets were blocked so with every flush the water was leaking out onto the outside carpet. The whole plane smelt of urine. Staff didn't even bother to go Check. I rang the bell to ask for some drinks for kids but no one came. The call switch is not the PIA staff's concern they just ignore you. My son went up again to get us drinks and was told no your not getting nothing. Useless rude and very lazy staff. Will NEVER travel with PIA again. If they can't run the airplane better just to shut it down and defiantly train your staff on manners and adequate. How to deal with people and maybe crack a smile"
Fleming,I called a PIA contact center to get an information regarding to carry a golf kit but it is regret to have a such situations call hanged up several of times put on hold with out permission and misguided too.It seems that PIA contact center of Islamabad agents have not gone through training to assist the query not this only they have only learned how to get hanged up the call on that condition anyway.Perhaps their supervisor namely Mr.Kashif who is not available the full week whenever i called.To ensure that the provided info was correct i requested to have a email which i can rely so they told me that due to limited excess we are helpless in this regards that was really a big shame to PIA. This is supposed to be my last trip with budget Airline either i would not suggest any one to be a part of PIA at any cost. I would like to mention their names which i got worst experience. 1-Raza 2-Muzammil 3-Hafiz 4-Kazim 5-Zahid and many more.
SOQ2010,"Prior on line checkin not available,(im not aware of it). Carry on bag was weighed along with checkin 2 pieces which go free . Lounge was okay . Priority boarding for business class passengers wasnt adequate.As i entered my seat was allready occupied by a lady (whatever the reason baby ,mental or physical limitation.)it reflected on cabin crews professionalism. Food ,service, cleanliness landing everything was good . , but letting someone occupy your seat left a veryyyy bad impression , authorities should look into it."
flyfisher66,"It was yet another horrible experience. I was going on a hunting trip and was carrying my hunting rifle with some ammo which I have done so many times in the past. The security guys from ASF inspected the weapon and ammo in detail and recorded everything, as per procedure. The PIA receptionist on the counter gave me a boarding pass and said that the weapon will be checked and booked by the guy from security department as per procedure which knew very well. I waited for the concerned guy for a long time but no one turned up. The lady on the counter kept telling me that he is just arriving. After 30 minutes, I contacted the supervisor who showed his inability to do anything more than that as it was time for shift change. People from old shift were leaving and new shift people had not yet arrived. Finally the guy arrived after 45 minutes, and took another 15 minutes to book the luggage. He inspected the weapon & ammo, took his notes and took over my rifle and suite case that carried the ammo in his possession. I had to rush for boarding as I had spent over one hour extra on the counter. The flight went well without any problem. But at Karachi, one of the bags didn't arrive. I contact the lost and found guys who were quite helpful but were unable to contact the concerned people back in Islamabad for more than an hour as no one was picking up. This was horrifying and very non-professional. I informed them again and again that they must get the whereabouts of the bag as it carries ammo. I asked them that weapons and ammo are handled exclusively so how could a bag carrying ammo didn't arrive but they had no reply for this? This was pure incompetence and non-professionalism on part of PIA staff. Finally, after more than 90 minutes of waiting, I was told that my bag has been found and it was taken down from the flight as it carried ammo. I was stunned on this revelation..... I asked them that they inspected everything, recorded it in their record than how could this happen but they had no satisfactory reply for that. My bag arrived next day from Islamabad. A horrifying experience indeed indicating a very irresponsible attitude. My advise for hunters and sport shooters who carry their weapons on air journeys; be very very careful when you are traveling with PIA. You must reach much in advance because they might take a long time in routine procedures. Also make sure that the security guy has done his job, recorded everything and also communicated to all concerned otherwise your bag might be taken down from the flight."
Sadz B,"I always travel with PIA as it goes directly to Lahore and travelling with two young kids is never easy therefore i avoid connecting flights. In the last two years i have travelled four times and i must say the service has really improved. The only downfall has been the broken seats on the plane and the TVs not working. In the past two years all i have ever heard is that sytem was being updated. Imean does it really take two years? There is nothing for the kids. It is not travel friendly at all for young kids. This varies from the food to the entertainment. Although , the service has improved i have decided to travel with Emirates/ Qatar. I think PIA needs to look at Singapore airlines in order to improve that aspect. 7 to 8 hours is a very long time with young kids there needs to be something . And yes we do pay for that service. I think im going to risk the connecting flight."
Nigel A,"Whilst it is true to say that PIA is not in the same league as some other airlines, they seem committed to a programme of continuous improvement which relies on passenger confidence. The flight offered no entertainment, but the seat was comfortable, the service and food good. Give them your support and they will continue to improve."
zeshan7,"Service was rubbish as always the flight was delayed by 2 hours. But we had to sit on the plane for over n hour. In flight entertainment wasn't work as usual, best thing was I got front row seats with plenty of leg room but seats were cramped together. Checking in at MAN AIR was great quick service but luggage claiming at new islamabad airport took ages. Travelling alone i had to wait over n hour for my suitcase. At border control i told the guy"
Rod B,"To be honest, Being a regular flyer with Emirates, I was a bit nervous to catch this internal flight within Pakistan. There was no need. Islamabad’s new airport was a swift passage through to the gate. The flight with PIA was excellent in economy. And I met a wonderful local gent on the flight who happily chatted and shared his magnificent photos of Northern Pakistan, which were simply beautiful. What a wonderful experience."
Raheel Qamar,The service has improved greatly and the staff are very friendly and courteous. There is good entertainment in flight and seats are quite roomy. Overall a good relaxing flight to go to Pakistan. Will recommend to others to fly PIA as well.
Zahir Rahimtoola,"I flew by PIA on an international sector after ages and I was pleasantly surprised with the excellent service, wish the aircraft was in a better condition, I took this flight with great apprehension as there is a lot of adverse publicity however the moment I boarded I was warmly welcomed by the stewardess Huma Wali who was looking after our section. She was extremely courteous and very helpful throughout the flight. The Senior Purser Azhar Khan made sure we were very well looked after and often came over to check on us. I certainly look forward to flying more on PIA."
smallhausen1,"Flight has been operated by ATR turboprop aircraft. Pros: 1. On time performance 2. Smooth check in Cons: 1. Not too much space for hand luggage 2. Not very clean interior 3. Very hard landing There is often no choice on domestic lines, so do not have high expectations"
Sarah,"The ISB-GIL flight has some amazing views and is better than the Skardu flight in this regard. Saw frozen lakes, Snow covered mountains and hidden valleys. The landing was an amazing experience as well. I enjoyed this flight. Only drawback was that our luggage did not all come in."
Hassan A,"Chor hain saalay, and 3rd Class service. Charged 40,000 PKR for 2 extra bags. Which should be only 220$USD according to their website. But Staff asked me to pay 320$ USD. Ran out with USD and paid 220$ USD Plus 140 CAD. So charged me 140$ CAD extra, jo k unki jaib main jaiga. I was flying as a new immigrant and selected that flight because there was enough time 6 hours gap for my connecting flight to Winnipeg, so that I can easily pass immigiration and custum matters, but on last day they have changed the timings of plane, and I got 3 hours of very short period of transit time to get my connecting flight. Aur sonay pe sohaga, they were unable to open the gate for 40 minutes after landing the plane at Torronto due to unknown reasons, 40 minutes yahan per zaya hogaye 2nd plane lenay se pehlay. I was running with my wife and 4 year old son to another terminal... and was nearly thr to miss my flight to Winnipeg... Lesson learned that I will never fly with PIA again ever."
Mark G,Well I am a frequent flyer on PIA due to having the only direct flight between London and Pakistan. The seats need maintained and reupholstered for a long haul flight. The visual display system is a catch. Bring your own entertainment or plan to go to sleep. Staff are always friendly and respectful. You may find you have to swap seats a few times if you end up sitting beside a female due to cultural norms - this is OK if that is the way it is. I am glad I have a FF card to board early.
AJ K,"Yes it is worst airline of the world and being proud Pakistani, i feel bad .. but this is a fact. Our misery started well before our travel date where we were travelling from Australia to KL and then taking PIA to Karachi, so flights were well sync'ed however PIA decided to cancel and move our KL to KHI flight about 5 times, which stuffed up our further itinerary, we had stay in Karachi for couple of days and travelling PIA again to Islamabad, however due to international flight changes, our domestic keep on changing, eventually we had to stay in KL for 2 days to catch PIA flight (which we didnt eventually, read on) but PIA refused to acknowledge any of the issues and told us any other flights are not their concern even domestic PIA because it was our of same PNR (PIA booking dont allow stay for 2 days under same PNR), and to rub more salt on wound, PIA downgraded our flights from Business to Economy WITHOUT LETTING US KNOW! , it is a long story but in summary we ended up changing flights 7 times,ending up changing our hotel booking in Karachi 7 times, and believe it or not, ended up paying for THEIR stuff up in domestic 3 times (about 80K).KL to Karachi was delayed for more then 180 hours and eventually they adjusted us in Thai (no thanks to PIA for that but special thanks to ground staff at KL airport specially shafi sb for their efforts) . We somehow reached Karachi 2 days late and Islamabad 4 days late, on way back i cancelled all of my PIA flights and waiting for refund from them (and yes good luck to me, that will be another review). AVOID THEM AT ANY COST if you are planning to connect to them from any destination, sync'ing just doesnt work for PIA"
DrSafiuddin,"Although had heard a lot of negative reviews about PIA, but we found the flight very comfortable. Seats are very spacious, crew is helpful and polite."
BMKhizar,A Good Airline but need a lot of improvements. The pilots are experienced but the overall system needs to be overhauled.
Ali A,"My Review title says it all, the most atrocious, almost barbaric, cave man style airline in the history of Aviation."
Ayaz B,"first experience to travel on an international route, very comfortable flight, big plane , comfortable seats & best food during the flight, much better then Thai air, direct flight from KL to KHI which save many hours in stopover & connecting flight . flight was also on time,friendly crew"
Fawad Masud,PIA is Good overall but there is a lot than can be done to make it a very good airline. Customer Service needs to be improved definitely. I have heard the staff for international flights is much better than domestic flights. Overall i would love to fly with my own Pakistani Airline.
Lulivo R,i want to share my experience here about very low rated air line PIA .i traveled with PIA accidentally but i found them very professional.
Imran K,"Words cannot describe how awful the service was on this PIA flight (London to Karachi, and also returning to London. Firstly, I ordered vegetarian food several weeks in advance, and this was noted on their system, but no such food was arranged for me on the 7-hour flight. The crew literally could not care less, and offered me a chicken meal, as an alternative! At first they didn't want to even ask their colleagues, but after a long argument, they got me a fee pieces of lettuce, at which point I loudly complained! They then served up some nasty uncooked pastry. Exactly same problem coming back! The seat worn torn and the inflight entertainment system did not work at all on my departing and returning journey - no excuse offered by crew. In my leg space area was a metal box, which reduced my leg space quite a bit. One of the crew members had a bad case of body odour. At Heathrow, the first officer was very rude and uninterested in hearing my complaint. I paid and extra 47,000 rupees (about 280 GBP to extend my flight for 14 days. Overall, my economy flight with the extension cost about 780 GBP).There are no circumstances I would EVER fly PIA again, even though its a direct flight. Horrible airline. Also the staff on the PIA booking line speak awful English and will often put the phone down on you as they cant understand what you are saying."
taquir,The airline rumored to be late was just on time in both departure and arrival. the seats were comparatively better and food was excellent with lot of choices.
veer2808,"Our recent experience with the national airline and flag carrier, Pakistan International Airlines (PIA) got me thinking. Have we become so used to travelling business class on international airlines because all our recent trips have been overseas, that we have become over-demanding? PERHAPS ITS ACCEPTABLE, for a local airliner to be over 3 hours delayed, not owing to weather or other natural causes, and yet not bother to inform passengers? PERHAPS ITS ACCEPTABLE, for an airline to keep its passengers waiting indefinitely with continually extending departure timings without giving any rhyme or reason for the delay. We finally boarded and, contrary to my apprehensions, the rest of the flight was not too bad. Though cramped as is the norm in Economy, the interior was clean and the service very pleasant and efficient. One thing’s for sure - PERHAPS ITS ACCEPTABLE - but if I can help it, never flying PIA again!"
mohammed k,"they have changed the name from business class to economy plus ,they charge for business class seat are broken had to try 5 before I found one that works lucky for me there where only 12 people in that class tv do not work food is sort of ok nowt to shout about toilets where small ,but the staff where very good lucky for me I had my laptop with me they do not have any usb or charging ports for the phone or laptop"
varunaja,"Expect delays and very poor cabin condition. Things seems to be improving, but not up to the world standards."
mohammadzuhirk,"My thoughts was the PIA domestic flight is not good, but this experience changed the picture. Good plane, on time departure, friendly cabin crew, and good service."
Fathila A,"It offered the cheapest flights for the dates we wanted. But our connection flight from Karachi to Heathrow was delayed for more than 24 hours. The staff couldn't give a clear reason for the delay. When they had given us an overnight stay at a hotel, they didn't let us take our checked in lugagges. At least they gave us priority check in the next day. One thing for sure, I can't complain about the airline's food. It's the best I had so far."
k1tyres,I am a business traveler and never in my 35 years of flying experienced such a poor airline. Truly ghastly and the worst experience of my life. Not only did my bags arrive over an hour late being a business class traveler but the ventilation system has caused me to have a chest infection. Islamabad airport VIP lounge only has one toilet which was occupied most of the time. The Pakistani community should boycott the airline and force the service to improve
sbashir786,"Avoid this cowboy airline unless you want to be humiliated and ill treated!!! I was due to travel back from Islamabad to Manchester on 03/09/18. We arrived at the airport to be informed that our flight had been cancelled. We received no prior notice of this. The PIA representative at the counter was extremely rude and dismissive and informed us that the flight had been cancelled due to technical issues. He lied and said they had contacted us via phone and email and when we asked for proof he was unable to provide this. We had confirmed our flights 2 days before at Kotli Azad Kashmir and were not made aware of any cancellations. The PIA agents also informed us that the flight got cancelled the previous evening - I feel this is insufficient notice! He failed to offer us an alternative flight but rather advised us to contact our travel agent and to go home. The PIA agent then walked away from the counter and another agent replaced him. In total we spoke to about 4 PIA agents before someone actually listened to our concerns. None of your agents were wearing name badges and refused to give us their names, one of your agents even started smoking in front of us without being on a break and was on a personal phone call whilst he should have been reassuring his customers. We kept being told to sit and wait. This went on for about 5 hours. Finally, we were offered an alternative flight to London and a later flight for the 07/09/18. We refused these options as London airport is 6 hours away from our home address and the flight for the 7th was too late due to school and work. After hours and hours of raising our concerns, finally we managed to get the agent to agree a flight for 04/09/18 at 11am to Birmingham (our original flight was to Manchester). We were not offered any apology, no compensation or travel fare to get us to a hotel. We travelled 5 hours from our address in Pakistan to get to Islamabad airport only to be disappointed and mistreated. We had used all our money thinking we would be going home on the 3rd September. We had to borrow money from relatives who had come to drop us off at the airport. We had to pay further money to arranged overnight accommodation, food and then the taxi back to the airport in the morning. Also, an expensive taxi from Birmingham to Rochdale (which is a 3-hour journey) I feel absolutely disheartened and extremely upset by the way my family and I were treated by PIA. Their customer service skills are shocking, they have absolute no regard for their customers and needless to say I will NEVER use them again!!"
mydellboy,H aving booked our holiday flights for 5 people with a return fare to kl for £1650 it seemed like a dream. However PIA cancelled the connecting flight from Karachi to kl just one week before departure.Therefore rearrangements had to be made and change of hotel dates be made to allow us to go. Then checking in at heathrow we were then told that we had no Visas and could not get any overnight.With the cancellation we now had to stay 2 nights in Karachi of which required a visa. We were told to sit and wait to see what could be done .We were then informed that we could continue to Karachi and see immigration at Karachi to see if we could be allowed to continue our journey...The dream had turned into a nightmare......never again with PIA.
i2Wander,"Yes, that's what they are - Greedy Liars. We booked tickets at the PIA counter and they confirmed the booking. When the time came to board the plane, they said the tickets are not confirmed and we had to pay twice for two tickets otherwise they did not let us board. We showed them the receipt but ALAS!!! We've been trying to contact their customer service for more than 2 weeks - emailed (on various email addresses they've mentioned on their official website), also called them a crazy number of times but no one has returned back to us. We had to rebook our tickets again and ended up paying thrice the money for no reason. PIA's customer service is RUBBISH (online and offline). We will never again travel with this airline and we will make sure that our friends and family avoid the hassle too!!! Sigh PIA, you just lost a number of potential customers!!!"
Hussainr,"For the first time we had a packed agenda for a trip to Pakistan. Given the amount of miles that we would cover over the next 2 weeks, We choose to fly with the national carrier of Pakistan - PIA. Against all the advice from family and friends, we braved it and managed to find a reasonable price for the flight (still could have been cheaper??). So you could say not a bad start?? However, this also meant that we returned to London Heathrow instead of Birmingham. Again, not a problem just meant we met up with more family and friends. So having booked with a reputable travel agent, the first issue was that we did not have one single booking. The travel agent booked us on 3 different bookings. We did not notice this until after the booking was made. Credit to the agent they managed to secure us 4 seats all together on all flights (or did they??) Birmingham departure - things went smoothly Islamabad arrival and departure (New airport) - all smooth and thumbs up for a new airport although early days as some of the facilities that were not up and running 100% Karachi departure - things went well, as expected. NOW for every single flight PIA had changed all there aircraft. Which meant that we were seated all over the aircraft. No thought given to the original seat numbers or seating requirement. Thankfully we managed to get to the airport early enough to negotiate seating together. Albeit this was a mission in itself. The staff that we dealt with on each of the counters (except Birmingham) found it a chore just being at work let alone be bothered to serve a polite request for seating together. Sadly, this just confirms other reviews of this airline. The flights themselves were below average. The on-board entertainment did not work and on approaching the cabin crew they were honest in there response. Which is satisfactory instead of being spun a line on why things do not work. The food was again average. The assuming thing was that there was 2 adults and 2 children in our travelling party. So how did we manage to get 3 different meals served? The drinks on the other hand were plentiful and water was always available where this has always been an issue on previous flights. The general maintenance of the interior of the aircraft is subject to personal opinions. You may be lucky to get a sat that actually, works i.e. reclines or you may get an automatic chair that reclines without any intervention from the occupier (simply put the seat is broken). Unfortunately, this is never a good formula especially if the person sitting behind you knows better than you and is not willing to understand. In general, you travel with PIA with your eyes wide shut. The 3 stars are because we managed to overcome most of the hurdles that we were faced with. I guess the other point is, yes PIA deliver a below than average service but it takes 2 to tango and passengers also have a level of responsibility."
Zee,"Disgusting service, hugely overpriced, horrible moody and rude flight attendants and airport staff. No in-flight entertainment but they still give you crap headphones, what are you supposed to do with them. Hardly any pillows or blankets. They change your direct return flight to via Karachi without informing you because they are deliberately over booking. People need to boycott PIA and then see how things quickly change. If you've never flown via the middle east on one of the other airlines then do, you probably won't go back to PIA again."
Saad K,"The airline isn't known for latest jets or superior service, but it was on time. For my trip, the most appealing aspect for choosing PIA was that it was the only airline plying directly between Karachi and Kuala Lumpur. Thus, the trip took only six hours, which is way better than the available alternates with at least one layover. Moreover, food was good."
